employer,headline,occupation,ai_industry,ai_locations,ai_technology
"Swedbank AB","Business Analyst",Systemanalytiker/Systemutredare,"Financial Services",Stockholm,"Master Data Management (MDM),IBM Integration Bus-platform,EVENT BUS,ETL procedure"
"Swedbank AB","Quality Assurance Software Engineer","Civilingenjör, systemutveckling",Banking,Stockholm,"Marketing Automation,Automated Testing Frameworks and Tools,Software Quality Assurance"
"Swedbank AB","Senior API Engineer to Anti Financial Crime",Applikationsutvecklare/Apputvecklare,"Financial Crime,Cyber Security","Riga,Stockholm HQ,Tallinn,Vilnius","API design,Java/Web development,Automated testing,Code review,Container platforms,Git,Linux,JIRA,Swagger,JavaScript,XML,JSON,Oracle,Web Services,MQ"
"Swedbank AB","Quality Assurance Software Engineer",Mjukvaruutvecklare,Banking,Stockholm,"Software Quality Assurance ,Automated Testing Frameworks and Tools ,Software Engineering ,PEGA Sales & Service"
"Swedbank AB","Infrastructure Engineer - Container Platform",Infrastrukturarkitekt,Banking,"Latvia, Lithuania","Containers,Cloud,Red Hat OpenShift,Kubernetes,Docker Swarm,Scripting languages,Integration patterns and API’s,CI/CD tools (Jenkins, Tekton, GitLab, etc.),Infrastructure management tools (Ansible, Terraform, etc.)"
"Swedbank AB","Software Engineer to Markets value stream",Mjukvaruutvecklare,"Financial Services",Stockholm,"Automation and scripting (shell script, Python, bash) ,Development (Java) ,System Integration (Message Broker, Cron, Sterling) ,Rest APIs and/or Web APIs"
"Swedbank AB","Business or Technical Analyst with Scrum Master ambitions","Affärskonsult, IT","Financial Services",Stockholm,"Product Backlog management,System implementation,Testing solutions in dedicated environments,Maintaining existing functionality"
"Swedbank AB","ServiceNow SecOps Software Engineer to the Cyber Security team",Systemanalytiker/Systemutredare,Banking,"Sundbyberg, Tallinn","ServiceNow security modules,MS Office (PowerPoint and Excel),JavaScript development,Web-based technologies (REST),ServiceNow SecOps products,ServiceNow System Administration, SIR and VR"
"Swedbank AB","Cyber Security Engineer to Anti Financial Crime unit",Systemanalytiker/Systemutredare,Banking,"Sundbyberg, Tallinn","Cloud,DevSecOps,Automation,Cyber Defence Centre’s Security Incident Response Team (SIRT),Security Operations Centre (SOC),Threat Intelligence (TI),Network Security,Log Management and Intelligence (UEBA, SIEM),Vulnerability Management,Malware Protection,Data Leakage Prevention,Network Access Control,Database Activity Monitoring"
"Swedbank AB","Software Engineer, Digital Banking",Systemutvecklare/Programmerare,Banking,"Sundbyberg, Umeå","Java,Spring Boot,Junit,Gradle,Angular,Git,Linux,JIRA"
"Swedbank AB","Product Owner to Card Issuing","Projektledare, IT","Card industry","Vilnius,Stockholm","SAFe (Scaled Agile Framework),Scrum,Agile framework"
"Swedbank AB","Product Owner to Cybersecurity services",Systemutvecklare/Programmerare,Banking,"Stockholm, Sundbyberg","SIEM (UEBA),DAM,EDR,FIM,NAC,WAF,DLP,NDR,IDS,NIST Cybersecurity Framework,ICT EBA guidelines,GDPR,PCI-DSS"
"Swedbank AB","Architect – AML Cloud Analytics and Data Lake","Säkerhetsanalytiker, IT",Financial,"Stockholm, Tallinn, Riga, Vilnius","AML (Anti Money Laundering),Datawarehouse,Onpremise data lake,Business Intelligence integrations,Data integrations and applications,Cloud platforms,Core Azure PaaS services,Big data solutions,ETL tool (AbInitio),Azure Machine Learning,Containerization (Kubernetes, Docker),Kafka or Azure Event Hub,DevOps ways of working,Infrastructure as code"
"Swedbank AB","Quality Assurance Software Engineer","Civilingenjör, systemutveckling",Banking,Stockholm,"Marketing Automation,Automated Testing Frameworks and Tools,Software Quality Assurance"
"Swedbank AB","iOS Developer",Applikationsutvecklare/Apputvecklare,Banking,"Umeå,Stockholm,Vilnius","Swift,Objective-C,Software Development,Agile Methodology,Git,Design Patterns,Architecture"
"Swedbank AB","Software Engineer",Mjukvaruutvecklare,Banking,Stockholm,"Java 11,REST,Springboot,Git"
"Swedbank AB","Software Engineer with API knowledge",Mjukvaruutvecklare,Banking,"Stockholm, Sundbyberg","REST-API,Java,.Net,Yaml,Angular,UNIX,Databases"
"Swedbank AB","Front-end development/ Full Stack developer",Frontend-utvecklare,Banking,Stockholm,"Angular framework,Java,Mobile application development"
"Swedbank AB","Systemutvecklare till Anti Financial Crime, Next Generation KYC",Systemutvecklare/Programmerare,Banking,Stockholm,"Git,Linux,Jenkins,JIRA,Eclipse,IntelliJ,Java,DevOps,CI/CD,PEGA-utveckling"
"Swedbank AB","Project Coordinator-Scrum Master",IT-strateg,Banking,"Stockholm, Vilnius","Sterling ,IBM Integration Bus ,BatchPortal"
"Swedbank AB","Software Engineer - Java",Mjukvaruutvecklare,Banking,"Sundbyberg, Stockholm","Java development,Tools,Full Stack,Infrastructure and integrations,SAFe methodology"
"Swedbank AB","Software Engineer - DBA",Mjukvaruutvecklare,Banking,"Sundbyberg, Stockholm","Database management, administration and performance,Infrastructure & configurations management,Java and development,Oracle DB"
"Swedbank AB","Driven Agile Product Owner with passion for change",Systemanalytiker/Systemutredare,Banking,Sundbyberg,"Genesys,Avaya"
"Swedbank AB","Agile coach",Systemutvecklare/Programmerare,"Banking & IT",Sundbyberg,"Agile ,Lean Thinking ,SAFe"
"Swedbank AB","Senior Datawarehouse Software Engineer",Mjukvaruutvecklare,"Credit Risk Calculations and Reporting","Stockholm, Sundbyberg","SQL,Datawarehouse- database development,IBM Mainframe,Powercenter"
"Swedbank AB","Senior Software Engineer - SAS Developer",Mjukvaruutvecklare,"Credit Risk Calculations and Reporting","Stockholm, Sundbyberg","Software development,SAS platform,Agile Product Owner,Architectural solution design,Testing"
"Swedbank AB","Analyst - Robotics & Intelligent Automation",Systemanalytiker/Systemutredare,Banking,"Vilnius, Lithuania and Stockholm, Sweden","Robotic Process Automation (RPA) ,Robotic Desktop Automation (RDA) ,Intelligent Automation ,Optical Character Recognition (OCR) ,Process Discovery ,Analysis ,Automation ,Improvement ,Documentation ,Process Maps ,Requirements and Acceptance Criteria ,Project & Stakeholder Management ,Incident Management"
"Swedbank AB","Senior DevOps engineer",Mjukvaruutvecklare,Banking,"Stockholm, Sundbyberg","Ansible ,GitOps ,Configuration as Code ,Continuous Integration ,Continuous Delivery ,Command Line ,Linux/Unix Based Systems ,Git ,Kubernetes Clusters ,Security by Code"
"Swedbank AB","Infrastructure Engineer",Systemutvecklare/Programmerare,FinTech,Stockholm/Tallinn,"Network security architecture,Firewall,ADC,Proxy solutions,IDS/IPS"
"Swedbank AB","Software Engineer in Data Warehouse",Mjukvaruutvecklare,Banking,"Latvia, Lithuania, Estonia","Databases and SQL,Data integration concepts and ETL"
"Swedbank AB","Quality Assurance Software Engineer",Mjukvaruutvecklare,Banking,Stockholm,"Software Quality Assurance ,Automated Testing Frameworks and Tools ,Software Engineering ,PEGA Sales & Service"
"Swedbank AB","iOS Developer to Savings & Advisory Transformation",Applikationsutvecklare/Apputvecklare,"Financial sector","Umeå, Stockholm","Software development,Test,Architectural work,Maintenance,iOS development,Design patterns,Architecture,Objective-C"
"Swedbank AB","Software Engineer",Systemadministratör,"Financial Risk Value Stream","Stockholm, Sundbyberg","Linux/Unix system administration,Python,SQL,Other scripting languages"
"Swedbank AB","Frontend Developer",Mjukvaruutvecklare,Banking,"Stockholm, Sundbyberg","HTML5,CSS3,JavaScript (Web Components),TypeScript,node.js,Angular or similar,Design systems,Style guides,Component libraries,WebDriver IO or other browser testing tools,Agile practice (test-driven development, scrum, CI/CD etc)"
"Swedbank AB","Software Engineer Steering BIO",Mjukvaruutvecklare,Banking,"Umeå, Sundbyberg","Teradata,SQL,Micro Strategy,BI area and data analyse"
"Swedbank AB","Senior UX/Visual Designer – Design Systems",Databasdesigner,Banking,Sundbyberg,"Sketch,InVision,Wireframes,Mockups,Prototypes,Flow diagrams"
"Swedbank AB","UX/Visual Designer – Design Systems",Databasdesigner,Banking,Sundbyberg,"Human Interface Guidelines (iOS),Material Design (Android),Sketch,InVision"
"Swedbank AB","Scrum Master",Mjukvaruutvecklare,"Banking & IT","Tallinn, Sundbyberg","Agile methodologies ,Different kinds of leadership ,Communication skills ,Structured, systematic problem solving"
"Swedbank AB","RPA Developer",Systemutvecklare/Programmerare,Banking,"Stockholm,Vilnius","APIs,Agile methodology,Technical specification documents"
"Swedbank AB","Database Administrator (Business Intelligence)",Databasadministratör,Banking,Estonia,"Teradata,Database Management Systems (DBMS),Scripting,Agile or SAFe framework"
"Swedbank AB","Monitoring Specialist","Säkerhetsadministratör, IT",Banking,"Stockholm, Tallinn","REST API,Programming skills (Python),Zabbix,Monitoring frameworks,Framework design"
"Swedbank AB","Android Developer to Savings & Advisory Transformation",Mjukvaruutvecklare,"Financial Sector","Stockholm, Umeå","Software Development,Test,Architectural Work,Maintenance,Java,Android Development,Design Patterns,Architecture,Git,Kotlin"
"Swedbank AB","Software Engineer with focus on Pega and Java",IT-arkitekt/Lösningsarkitekt,Banking,Sundbyberg,"Pega,Java,DevSecOps,Cloud technologies (Azure, AWS),Automation,Continuous Delivery"
"Swedbank AB","Business Analyst",Systemanalytiker/Systemutredare,"Financial Services","Stockholm, Tallinn","Microsoft Office 365 Suite,Teams,Exchange Online,Sharepoint Online,JIRA"
"Swedbank AB","Infrastructure engineer Midrange, Mainframe services tech stream",Mjukvaruutvecklare,Banking,"Stockholm, Sundbyberg","HPE NonStop infrastructure,IBMi,Mainframe platform"
"Swedbank AB","Software Engineer with focus on Pega and Java",IT-arkitekt/Lösningsarkitekt,Banking,Sundbyberg,"Pega,Java,DevSecOps,Cloud technologies (Azure, AWS),Automation,Continuous Delivery"
"Swedbank AB","ScrumMaster to Group BI",Systemutvecklare/Programmerare,Banking,Sundbyberg,"Agile ,Scrum ,SAFe"
"Swedbank AB","Business Analyst",Systemanalytiker/Systemutredare,Banking,"Sundbyberg, Tallinn","Core Infrastructure ,Agile ,Process Development"
"Swedbank AB","Development portfolio coordinator",Systemanalytiker/Systemutredare,Banking,Sundbyberg,"Business,IT,Mortgage,Customer Satisfaction,Anti Financial Crime"
"Swedbank AB","iOS Developer",Applikationsutvecklare/Apputvecklare,Banking,"Umeå,Stockholm,Vilnius","Swift,Objective-C,Git,Agile methodology"
"Swedbank AB","UX-designer to Anti Financial Crime",Mjukvaruutvecklare,"Financial Services","Sundbyberg, Stockholm","HTML,CSS,JavaScript,Sketch,Invision"
"Swedbank AB","Portfolio Manager",Systemanalytiker/Systemutredare,Banking,"Sundbyberg, Stockholm","Portfolio management,IT development,New technologies"
"Swedbank AB","Head of AML Engineering Guild, Anti Financial Crime",Systemutvecklare/Programmerare,"Finance, Financial Crime, AML/CTF, KYC","Stockholm, Tallinn, Riga, Vilnius","Agile Development frameworks,Jira,Confluence,MS Excel,PowerPoint"
"Swedbank AB","Accessibility specialist (Tech Development)",Systemutvecklare/Programmerare,Banking,"Stockholm, Sundbyberg","Web,Desktop,Mobile"
"Swedbank AB","Team Manager for Software Engineers, AML Engineering Guild, Anti Financi...",Mjukvaruutvecklare,"Finance, Financial Crime, Cybersecurity","Stockholm, Tallin, Riga, Vilnius","CI/CD,DevOps methods,Agile Development frameworks"
"Swedbank AB","Software Engineer",Systemadministratör,"Financial Risk Value Stream","Stockholm, Sundbyberg","Linux/Unix system administration,Python,SQL,Other scripting languages"
"Swedbank AB","Business Analyst",Systemanalytiker/Systemutredare,Banking,"Umeå or Stockholm","Core messaging communication services and notifications,Agile development,Life cycle management,Maintenance,Regulatory compliance,Business acceptance testing"
"Swedbank AB","Software Engineer/Application Administrator",Mjukvaruutvecklare,Banking,Stockholm,"Websphere-applikationer,Stordator-applikationer,ISO 20022,Linux-/Websphere-miljö,Mainframe Cobol/Compiler,DB2,IBM Filemanager,z/OS,XML/PureXML,FaultAnalyzer,CMN Changeman (Librarian),MQ,IMS,OPC Scheduler"
"Swedbank AB","Senior DevOps engineer",Mjukvaruutvecklare,Banking,"Stockholm, Sundbyberg","Ansible,GitOps,Configuration as Code,Continuous Integration,Continuous Delivery,Linux/Unix based systems,Git,Kubernetes,Security by Code"
"Swedbank AB","API Tech / developer",Applikationsutvecklare/Apputvecklare,Banking,Swedbank,"API design,Development and life-cycle management of both public and private APIs, in the cloud and on premise,Agile environment,Pipelines"
"Swedbank AB","Business Analyst to Retail Payments",IT-arkitekt/Lösningsarkitekt,"Retail payments",Sundbyberg,"Digitalization,Agile process,Analyzing,Documenting requirements,Business needs,Testing solutions"
"Swedbank AB","DevOps Engineer","Civilingenjör, systemutveckling",Banking,Sundbyberg,"Ansible,Continuous Integration,Continuous Delivery,Command Line,Linux/Unix Based Systems,Git,Kubernetes Clusters,Security by Code"
"Swedbank AB","Cobol Software Engineer",Mjukvaruutvecklare,Banking,"Stockholm HQ, Riga, Tallinn or Vilnius","Cobol/Mainframe,DB2,COBOL,SQL,IMS/DB,JCL,pureXML,Tivoli scheduler (OPC),Changeman"
"Swedbank AB","IT Process Manager",Systemutvecklare/Programmerare,Banking,"Stockholm, Tallinn or Vilnius","CI/CD,DevOps,IT Service Management (ITIL),IT Governance (COBIT)"
"Swedbank AB","Product Owner focused on Innovation, AI, and Cloud at Anti Financial Crime",Systemutvecklare/Programmerare,"Finance,Financial Crime,Cyber Security","Sundbyberg,Riga,Tallin,Vilnius","Cloud,Analytics,AI,API's,Agile Development Frameworks"
"Swedbank AB","UX/Visual Designer – Design Systems",Databasdesigner,"Financial Services",Sundbyberg,"Human Interface Guidelines (iOS) ,Material Design (Android) ,Sketch ,InVision"
"Swedbank AB","Agile Product Owner",Applikationsutvecklare/Apputvecklare,Banking,Umeå,"Mobile App Infrastructure,New Technologies,Agile Methodologies"
"Swedbank AB","Software Engineer focused on IBM Integration Platform",Mjukvaruutvecklare,Financial,Stockholm,"Master Data Management (MDM),IBM Integration Bus-platform,Message Broker flows,Java script,Python,SQL,FIX,Swift"
"Swedbank AB","UX Designer mobile app",Användbarhetsdesigner,Banking,"Stockholm, Sundbyberg","Sketch,InVision,Design tools"
"Swedbank AB","UX designer (web/intranet)",Användbarhetsdesigner,"Financial Services","Stockholm, Sundbyberg","User Centered Design,Mobile UX Best Practices and Patterns,Design Systems,Design Tools (Sketch, InVision)"
"Swedbank AB","Batch tekniker",Systemutvecklare/Programmerare,Banking,Stockholm/Umeå,"JCL,Batch Flows,Agile Methods,DB2,COBOL,OPC"
"Swedbank AB","Realtime Data Streaming Developer",Systemanalytiker/Systemutredare,Banking,"Stockholm, Sundbyberg","Confluent Kafka,KSQL db,Java applications,RDBMS,Azure,MicroStrategy,hdfs,Apache Kafka,Flume,Storm,MQ,ETL,Java,Scala,SQL,Unix"
"Scania IT","Var med och utveckla Scanias framtid!",Systemutvecklare/Programmerare,Transportbranschen,"Sverige, Holland, Frankrike, Belgien, Latinamerika och Indien",".Net,Angular,Test Automation,Data Warehousing/BI,AVS,Azure"
"Swedbank AB","Senior Business Analyst",Systemanalytiker/Systemutredare,Banking,"Sundbyberg, Stockholm","PEGA Sales & Service,Internet bank,Mobile app,JIRA"
"Swedbank AB","Infrastructure engineer z/OS platform, Mainframe services tech stream",Infrastrukturarkitekt,Banking,Stockholm,"IBM Mainframe infrastructure,z/OS platform"
"Swedbank AB","Senior Business Analyst",Systemanalytiker/Systemutredare,Banking,"Sundbyberg, Stockholm","PEGA Sales & Service,Internet bank,Mobile app"
"Swedbank AB","UX Designer web/intranet",Användbarhetsdesigner,"Financial Services","Stockholm, Sundbyberg","User Centered Design,Mobile UX Best Practices and Patterns,Design Systems,Design Tools (Sketch, InVision)"
"Swedbank AB","Business Analyst, Intelligent Automation and Robotics",IT-arkitekt/Lösningsarkitekt,"Financial Institute",Stockholm,"Business Process Automation,Robotic Process Automation,Business Process Management and Analysis,Agile Methodologies,Lean or Six Sigma methods,Outlook,Word,Excel"
"Swedbank AB","Software engineer with test focus to Retail Payments",Systemutvecklare/Programmerare,Banking,Sundbyberg,"Java,ISTQB,Agile Ways of Working"
"Scania IT","Testledare till Scania IT",Testledare,"Lastbilstillverkare,Tjänsteleverantör av kompletta transportlösningar","Sverige,Holland,Frankrike,Belgien,Latinamerika,Indien","Systemutveckling,IT-drift,Infrastruktur,Digitalisering,Mjukvaruutveckling,Automatiserade tester,Manuella systemtester,Agila sammanhang,Scrum,Kanban"
"Swedbank AB","Software Engineer to Markets value stream",Mjukvaruutvecklare,"Financial Services",Stockholm,"Automation and scripting (shell script, Python, bash) ,Development (Java) ,System Integration (Message Broker, Cron, Sterling) ,Rest APIs and/or Web APIs"
"Swedbank AB","Senior UX Designer",Användbarhetsdesigner,Banking,"Sundbyberg, Stockholm","User research,Usability testing,Concepts,Wireframing,Sketch,Invision"
"Swedbank AB","Business Analyst",IT-arkitekt/Lösningsarkitekt,Banking,Göteborg,"Conversational AI,Live chat service,Multi-language Virtual assistant"
"Swedbank AB","Business Analyst",IT-arkitekt/Lösningsarkitekt,Banking,Stockholm,"User stories,Acceptance criteria,MVPs,Agile Product Owner,Cross functional team"
"Swedbank AB","Accessibility specialist (Tech Development)",Systemutvecklare/Programmerare,Banking,"Stockholm, Sundbyberg","Web development,Desktop development,Mobile development,User interface systems"
"Swedbank AB","Fullstack Utvecklare",Mjukvaruutvecklare,"Financial Services",Stockholm,"Angular,Angular JS,ngrx,TypeScript,Java,REST,JSON,Design patterns"
"Swedbank AB","Accessibility Specialist – Design",Mjukvaruutvecklare,Banking,"Stockholm, Sundbyberg","Digital channels design and content,Accessibility and inclusive design,Web and app teams"
"Swedbank AB","UI-developer to Anti Financial Crime",Mjukvaruutvecklare,"Financial Services","Sundbyberg, Stockholm","HTML,CSS,React,JavaScript,Sketch,Invision"
"Swedbank AB","AppUI iOS Developer",Applikationsutvecklare/Apputvecklare,Banking,Umeå,"User Interfaces,Architectural Work,Testing,Maintenance,Latest Technology,iOS Development,Agile Methodology,Design Patterns,Architecture"
"Swedbank AB","Lead Architect to BI Infrastructure Agile Release Train (ART)","Civilingenjör, systemutveckling",Financial,"Sundbyberg, Tallinn, Riga, Vilnius","Agile Release Train (ART),Datawarehouse,Onpremise data lake,Cloud migration,Business Intelligence,DevOps,DataOps,Delivery Frameworks,AnalyticsOps,Infrastructure as code,Information architecture,Data governance,BI service development methodology"
"Swedbank AB","AppUI Android Developer",Applikationsutvecklare/Apputvecklare,Banking,Umeå,"User Interfaces,Architectural Work,Testing,Maintenance,Android Development,Kotlin,Native Frameworks,UI Design,Agile Methodology,Clean, Testable and Maintainable Code"
"Swedbank AB","Risk Analyst to Anti Financial Crime unit","Säkerhetsansvarig, IT","Financial Services","Stockholm or Tallinn","Machine Learning,Artificial Intelligence,Visio,Excel,PowerPoint"
"Swedbank AB","Software Developer in Windows Server Engineering",Mjukvaruutvecklare,"Financial Services",N/A,"Windows Server Platform,On Premise and Azure Tooling,Infrastructure as Code,Virtualization,Cloud Technologies"
"Swedbank AB","Team Manager Fund & Equity Services",Systemadministratör,"Financial services","Sundbyberg, Stockholm","Change management,Agile teams,Coaching leadership style"
"Swedbank AB","IT operation Problem Management Coordinator",IT-tekniker/Datatekniker,Banking,"Sundbyberg, Stockholm","Problem Management,Incident- and Change Management,IT operations processes,Project Management,Networking,Customer centric,Result oriented"
"Swedbank AB","Software Engineer in Data Warehouse",Mjukvaruutvecklare,Banking,"Latvia, Lithuania, Estonia","Databases and SQL,Data integration concepts and ETL"
"Swedbank AB","Software Engineer with focus on Teradata and Powercenter",Systemutvecklare/Programmerare,Banking,Sundbyberg,"Relational Databases ,Teradata ,Powercenter ,Data Warehouse ,Microsoft SQL Server ,SQL Server Integration Services, SSIS"
"Swedbank AB","Domain Architect / Engineer for Microsoft Office365 services",Infrastrukturarkitekt,Banking,"Latvia,Lithuania,Estonia","Microsoft Office 365,Other collaboration services"
"Swedbank AB","Senior Software Engineer",Mjukvaruutvecklare,"Digital Banking",Stockholm,"Java 11,REST,Springboot,Git"
"Swedbank AB","Architect – BI Infrastructure Architect to Datawarehouse","Data Warehouse specialist",Financial,"Stockholm, Sundbyberg","Agile Release Train (ART),Datawarehouse,On-premise data lake,Cloud migration,Business Intelligence,DevOps,DataOps,AnalyticsOps/CICD,Data governance,Infrastructure as code,SAFe"
"Swedbank AB","Software Engineer",Mjukvaruutvecklare,Banking,Sundbyberg,"Microstrategy,Business Objects,Qlikview/Qlik Sense,SPSS Modeler"
"Swedbank AB","Several Driven Business Analysts to the Payment’s Domain",IT-arkitekt/Lösningsarkitekt,Banking,Stockholm/Vilnius,"SAFe,ISO 20022,Business Analysis,Requirement Management,Acceptance Testing"
"Swedbank AB","Architect – Cloud Analytics and Data Lake",IT-arkitekt/Lösningsarkitekt,Financial,"Stockholm, Tallin, Riga, Vilnius","AML (Anti Money Laundering),Datawarehouse,Onpremise data lake,Business Intelligence integrations,Cloud platforms,Core Azure PaaS services,Big data solutions,ETL tool (AbInitio),Azure Machine Learning,Containerization (Kubernetes, Docker),Kafka or Azure Event Hub,DevOps ways of working,Infrastructure as code,SAFe"
"Swedbank AB","Agile Product Owner in Payments Infrastructure","Projektledare, IT",Banking,Remote,"Project management,Knowledge of the payment product area and payment market environment,Agile,Time, dependency, and stakeholder management"
"Swedbank AB","Software Engineer på Fund Distribution",Mjukvaruutvecklare,"Financial Services","Sundbyberg, Stockholm","Windows Platform,MS SQL server,Active Directory,Message Queue (MQ),Jira,Confluence,GIT,Java"
"Swedbank AB","Business analyst inom Swedbank HR & Payroll",Systemanalytiker/Systemutredare,Bank,"Stockholm Sundbyberg, Östersund, Umeå","Processutveckling,Systemintegration,Cloud-lösningar,Oracle HCM,POL från CGI"
"Swedbank AB","Several Driven Business Analysts to the Payment’s Domain",IT-arkitekt/Lösningsarkitekt,Banking,Stockholm/Vilnius/Tallin/Riga,"SAFe,ISO 20022,Business Analysis,Requirement Management,Acceptance Testing,Agile Ways of Working"
"Swedbank AB","Quantitative Analyst/Data Analyst",Systemanalytiker/Systemutredare,Banking,Sundbyberg,"SQL,SAS,Statistical and mathematical modelling techniques"
"Swedbank AB","Head of Information Security Assurance",IT-säkerhetschef,"Financial Services","Sundbyberg,Riga,Tallin,Vilnius","GRC tools,Data-centric approach,Automation"
"Swedbank AB","Head of Information Security Transformation",IT-säkerhetschef,"Financial services","Sundbyberg,Riga,Tallin,Vilnius","Information security,Risk management,IT enterprise program management,Change management"
"Swedbank AB","Quantitative Analyst/Data Analyst",Systemanalytiker/Systemutredare,Banking,Sundbyberg,"SQL,SAS,Statistical and mathematical modelling techniques"
"Swedbank AB","Quant Risk Developer",Systemanalytiker/Systemutredare,"Financial Services","Sundbyberg, Stockholm","Database and SQL development,Script programming (Python, Shell-script, Java, C#),Database design (information modelling, SSIS, Store Procedures, Functions etc.)"
"Swedbank AB","Business Analyst to Enabling API",Systemutvecklare/Programmerare,Banking/Payments,"Sundbyberg, Stockholm","Developing and maintaining the payments and transfers functionality in Swedbanks different digital channels like Internet and Mobile bank,Agile way of working (Scrum and SAFe),Re-designing, building and integrating a technology to support reliable, modularized and ready-to-use components"
"Swedbank AB","Security Assurance and Reporting Specialist","Säkerhetsansvarig, IT","Financial services","Sundbyberg,Tallinn,Riga,Vilnius","GRC tools,Data analytics and BI tools"
"Swedbank AB","Senior Data Analyst","Metodanalytiker, IT",Savings/Insurance,"Stockholm, Sundbyberg","Power BI,Qlik,Microstrategy,SQL queries"
"Swedbank AB","Co-Lead LC&I BIO Tech Accelerator - Agile Product Owner (APO)",Mjukvaruutvecklare,Banking,"Stockholm City","Agile,Backlog,Tech Accelerator,Stand-ups,Communication,Collaboration,IT Development,Analysis,Financial Markets"
"Swedbank AB","Test environment engineer",Mjukvaruutvecklare,Banking,"Stockholm, Sundbyberg / Umeå","IBM Mainframe,Teradata systems,PowerCenter,OPC,GIT,Test Automation"
"Swedbank AB","Business Analyst, Employee tools",Systemanalytiker/Systemutredare,Banking,"Sundbyberg, Stockholm","Requirements and relevant stakeholders,MVP's and user stories,Acceptance criteria,Data driven development,Analytics tools,Acceptance test"
"Swedbank AB","Infrastructure engineer/Software engineer",Mjukvaruutvecklare,Banking,"Stockholm and Tallinn","Switching and routing,802.1x protocol,Design and development of client networks, cabled and wireless,CISCO firewalls and DNA,Programming and scripting (Python and SQL),Azure"
"Swedbank AB","Head of IT Internal Audit in Swedbank – Digital Banking and IT Audit Team",IT-säkerhetschef,Financial,Sundbyberg,"Data Analytics,Automation Techniques,Data Automation"
"Swedbank AB","Infra Engineer",Systemutvecklare/Programmerare,"Banking and Finance","Stockholm HQ, Riga, Tallin, Vilnius","Building data integrations,DevOps, DevSecOps, and MLOps,Containerisation and microservices,Distributed, high-volume data pipelines,CI/CD pipelines,Azure DevOps or similar CI/CD tool,Kafka and Databricks,APIs (e.g. Swagger; FastAPI),Docker,Kubernetes or OpenShift"
